{
  "scene_name": "standby1",
  "frame_start": 0,
  "frame_end": 1500,
  "fps": 1000,
  "animated_objects": [
    {
      "object_name": "body_x",
      "object_type": "MESH",
      "action_name": "standby1",
      "keyframe_data": [
        {
          "frame_number": 0,
          "active_axis": "z",
          "rotation_angle": 90
        },
        {
          "frame_number": 1500,
          "active_axis": "z",
          "rotation_angle": 90
        }
      ]
    },
    {
      "object_name": "head_y",
      "object_type": "EMPTY",
      "action_name": "standby1",
      "keyframe_data": [
        {
          "frame_number": 0,
          "active_axis": "x",
          "rotation_angle": 100
        },
        {
          "frame_number": 1500,
          "active_axis": "x",
          "rotation_angle": 100
        }
      ]
    }
  ]
}
