{
  "scene_name": "thinking",
  "frame_start": 0,
  "frame_end": 30,
  "fps": 10,
  "animated_objects": [
    {
      "object_name": "body_x",
      "object_type": "MESH",
      "action_name": "thinking",
      "keyframe_data": [
        {
          "frame_number": 0,
          "active_axis": "z",
          "rotation_angle": 90
        },
        {
          "frame_number": 2,
          "active_axis": "z",
          "rotation_angle": 85
        },
        {
          "frame_number": 5,
          "active_axis": "z",
          "rotation_angle": 85
        },
        {
          "frame_number": 8,
          "active_axis": "z",
          "rotation_angle": 100
        },
        {
          "frame_number": 15,
          "active_axis": "z",
          "rotation_angle": 100
        },
        {
          "frame_number": 18,
          "active_axis": "z",
          "rotation_angle": 82
        },
        {
          "frame_number": 25,
          "active_axis": "z",
          "rotation_angle": 82
        },
        {
          "frame_number": 30,
          "active_axis": "z",
          "rotation_angle": 90
        }
      ]
    },
    {
      "object_name": "head_y",
      "object_type": "EMPTY",
      "action_name": "thinking",
      "keyframe_data": [
        {
          "frame_number": 5,
          "active_axis": "x",
          "rotation_angle": 100
        },
        {
          "frame_number": 8,
          "active_axis": "x",
          "rotation_angle": 101
        },
        {
          "frame_number": 13,
          "active_axis": "x",
          "rotation_angle": 101
        },
        {
          "frame_number": 16,
          "active_axis": "x",
          "rotation_angle": 100
        },
        {
          "frame_number": 20,
          "active_axis": "x",
          "rotation_angle": 102
        },
        {
          "frame_number": 26,
          "active_axis": "x",
          "rotation_angle": 102
        },
        {
          "frame_number": 30,
          "active_axis": "x",
          "rotation_angle": 100
        }
      ]
    }
  ]
}
