{
  "scene_name": "fondle_anger",
  "frame_start": 0,
  "frame_end": 71,
  "fps": 10,
  "animated_objects": [
    {
      "object_name": "body_x",
      "object_type": "MESH",
      "action_name": "fondle_anger",
      "keyframe_data": [
        {
          "frame_number": 0,
          "active_axis": "z",
          "rotation_angle": 90
        },
        {
          "frame_number": 6,
          "active_axis": "z",
          "rotation_angle": 90
        },
        {
          "frame_number": 7,
          "active_axis": "z",
          "rotation_angle": 80
        },
        {
          "frame_number": 9,
          "active_axis": "z",
          "rotation_angle": 100
        },
        {
          "frame_number": 11,
          "active_axis": "z",
          "rotation_angle": 80
        },
        {
          "frame_number": 13,
          "active_axis": "z",
          "rotation_angle": 100
        },
        {
          "frame_number": 15,
          "active_axis": "z",
          "rotation_angle": 80
        },
        {
          "frame_number": 17,
          "active_axis": "z",
          "rotation_angle": 90
        },
        {
          "frame_number": 25,
          "active_axis": "z",
          "rotation_angle": 90
        },
        {
          "frame_number": 26,
          "active_axis": "z",
          "rotation_angle": 95
        },
        {
          "frame_number": 27,
          "active_axis": "z",
          "rotation_angle": 85
        },
        {
          "frame_number": 28,
          "active_axis": "z",
          "rotation_angle": 95
        },
        {
          "frame_number": 29,
          "active_axis": "z",
          "rotation_angle": 85
        },
        {
          "frame_number": 30,
          "active_axis": "z",
          "rotation_angle": 95
        },
        {
          "frame_number": 31,
          "active_axis": "z",
          "rotation_angle": 85
        },
        {
          "frame_number": 32,
          "active_axis": "z",
          "rotation_angle": 95
        },
        {
          "frame_number": 33,
          "active_axis": "z",
          "rotation_angle": 85
        },
        {
          "frame_number": 34,
          "active_axis": "z",
          "rotation_angle": 95
        },
        {
          "frame_number": 35,
          "active_axis": "z",
          "rotation_angle": 85
        },
        {
          "frame_number": 36,
          "active_axis": "z",
          "rotation_angle": 90
        },
        {
          "frame_number": 40,
          "active_axis": "z",
          "rotation_angle": 90
        },
        {
          "frame_number": 43,
          "active_axis": "z",
          "rotation_angle": 75
        },
        {
          "frame_number": 46,
          "active_axis": "z",
          "rotation_angle": 75
        },
        {
          "frame_number": 49,
          "active_axis": "z",
          "rotation_angle": 105
        },
        {
          "frame_number": 57,
          "active_axis": "z",
          "rotation_angle": 105
        },
        {
          "frame_number": 62,
          "active_axis": "z",
          "rotation_angle": 90
        }
      ]
    },
    {
      "object_name": "head_y",
      "object_type": "EMPTY",
      "action_name": "fondle_anger",
      "keyframe_data": [
        {
          "frame_number": 0,
          "active_axis": "x",
          "rotation_angle": 100
        },
        {
          "frame_number": 3,
          "active_axis": "x",
          "rotation_angle": 115
        },
        {
          "frame_number": 15,
          "active_axis": "x",
          "rotation_angle": 115
        },
        {
          "frame_number": 18,
          "active_axis": "x",
          "rotation_angle": 100
        },
        {
          "frame_number": 20,
          "active_axis": "x",
          "rotation_angle": 100
        },
        {
          "frame_number": 22,
          "active_axis": "x",
          "rotation_angle": 105
        },
        {
          "frame_number": 40,
          "active_axis": "x",
          "rotation_angle": 105
        },
        {
          "frame_number": 42,
          "active_axis": "x",
          "rotation_angle": 125
        },
        {
          "frame_number": 57,
          "active_axis": "x",
          "rotation_angle": 125
        },
        {
          "frame_number": 62,
          "active_axis": "x",
          "rotation_angle": 100
        }
      ]
    }
  ]
}
