{
  "scene_name": "standby",
  "frame_start": 0,
  "frame_end": 40,
  "fps": 10,
  "animated_objects": [
    {
      "object_name": "body_x",
      "object_type": "MESH",
      "action_name": "standby",
      "keyframe_data": [
        {
          "frame_number": 0,
          "active_axis": "z",
          "rotation_angle": 90
        }
      ]
    },
    {
      "object_name": "head_y",
      "object_type": "EMPTY",
      "action_name": "standby",
      "keyframe_data": [
        {
          "frame_number": 0,
          "active_axis": "x",
          "rotation_angle": 100
        },
        {
          "frame_number": 15,
          "active_axis": "x",
          "rotation_angle": 101
        },
        {
          "frame_number": 30,
          "active_axis": "x",
          "rotation_angle": 100
        }
      ]
    }
  ]
}
