{
  "scene_name": "disconnect",
  "frame_start": 0,
  "frame_end": 31,
  "fps": 10,
  "animated_objects": [
    {
      "object_name": "body_x",
      "object_type": "MESH",
      "action_name": "disconnect",
      "keyframe_data": [
        {
          "frame_number": 0,
          "active_axis": "z",
          "rotation_angle": 90
        },
        {
          "frame_number": 6,
          "active_axis": "z",
          "rotation_angle": 90
        },
        {
          "frame_number": 9,
          "active_axis": "z",
          "rotation_angle": 100
        },
        {
          "frame_number": 12,
          "active_axis": "z",
          "rotation_angle": 80
        },
        {
          "frame_number": 15,
          "active_axis": "z",
          "rotation_angle": 100
        },
        {
          "frame_number": 18,
          "active_axis": "z",
          "rotation_angle": 85
        },
        {
          "frame_number": 21,
          "active_axis": "z",
          "rotation_angle": 95
        },
        {
          "frame_number": 24,
          "active_axis": "z",
          "rotation_angle": 90
        }
      ]
    },
    {
      "object_name": "head_y",
      "object_type": "EMPTY",
      "action_name": "disconnect",
      "keyframe_data": [
        {
          "frame_number": 0,
          "active_axis": "x",
          "rotation_angle": 100
        },
        {
          "frame_number": 3,
          "active_axis": "x",
          "rotation_angle": 110
        },
        {
          "frame_number": 22,
          "active_axis": "x",
          "rotation_angle": 110
        },
        {
          "frame_number": 25,
          "active_axis": "x",
          "rotation_angle": 100
        }
      ]
    }
  ]
}
