{
  "scene_name": "focus",
  "frame_start": 0,
  "frame_end": 47,
  "fps": 10,
  "animated_objects": [
    {
      "object_name": "body_x",
      "object_type": "MESH",
      "action_name": "focus",
      "keyframe_data": [
        {
          "frame_number": 0,
          "active_axis": "z",
          "rotation_angle": 90
        }
      ]
    },
    {
      "object_name": "head_y",
      "object_type": "EMPTY",
      "action_name": "focus",
      "keyframe_data": [
        {
          "frame_number": 0,
          "active_axis": "x",
          "rotation_angle": 100
        },
        {
          "frame_number": 2,
          "active_axis": "x",
          "rotation_angle": 110
        },
        {
          "frame_number": 3,
          "active_axis": "x",
          "rotation_angle": 100
        },
        {
          "frame_number": 7,
          "active_axis": "x",
          "rotation_angle": 105
        },
        {
          "frame_number": 14,
          "active_axis": "x",
          "rotation_angle": 105
        },
        {
          "frame_number": 16,
          "active_axis": "x",
          "rotation_angle": 100
        },
        {
          "frame_number": 18,
          "active_axis": "x",
          "rotation_angle": 105
        },
        {
          "frame_number": 20,
          "active_axis": "x",
          "rotation_angle": 100
        },
        {
          "frame_number": 22,
          "active_axis": "x",
          "rotation_angle": 105
        },
        {
          "frame_number": 38,
          "active_axis": "x",
          "rotation_angle": 105
        },
        {
          "frame_number": 42,
          "active_axis": "x",
          "rotation_angle": 100
        }
      ]
    }
  ]
}
