{
  "scene_name": "sad",
  "frame_start": 0,
  "frame_end": 78,
  "fps": 10,
  "animated_objects": [
    {
      "object_name": "body_x",
      "object_type": "MESH",
      "action_name": "sad",
      "keyframe_data": [
        {
          "frame_number": 0,
          "active_axis": "z",
          "rotation_angle": 90
        },
        {
          "frame_number": 5,
          "active_axis": "z",
          "rotation_angle": 90
        },
        {
          "frame_number": 10,
          "active_axis": "z",
          "rotation_angle": 80
        },
        {
          "frame_number": 20,
          "active_axis": "z",
          "rotation_angle": 100
        },
        {
          "frame_number": 30,
          "active_axis": "z",
          "rotation_angle": 80
        },
        {
          "frame_number": 40,
          "active_axis": "z",
          "rotation_angle": 100
        },
        {
          "frame_number": 50,
          "active_axis": "z",
          "rotation_angle": 80
        },
        {
          "frame_number": 60,
          "active_axis": "z",
          "rotation_angle": 100
        },
        {
          "frame_number": 70,
          "active_axis": "z",
          "rotation_angle": 80
        },
        {
          "frame_number": 75,
          "active_axis": "z",
          "rotation_angle": 90
        }
      ]
    },
    {
      "object_name": "head_y",
      "object_type": "EMPTY",
      "action_name": "sad",
      "keyframe_data": [
        {
          "frame_number": 0,
          "active_axis": "x",
          "rotation_angle": 100
        }
      ]
    }
  ]
}
