{
  "scene_name": "shock",
  "frame_start": 0,
  "frame_end": 23,
  "fps": 10,
  "animated_objects": [
    {
      "object_name": "body_x",
      "object_type": "MESH",
      "action_name": "shock",
      "keyframe_data": [
        {
          "frame_number": 0,
          "active_axis": "z",
          "rotation_angle": 90
        }
      ]
    },
    {
      "object_name": "head_y",
      "object_type": "EMPTY",
      "action_name": "shock",
      "keyframe_data": [
        {
          "frame_number": 1,
          "active_axis": "x",
          "rotation_angle": 100
        },
        {
          "frame_number": 2,
          "active_axis": "x",
          "rotation_angle": 115
        },
        {
          "frame_number": 6,
          "active_axis": "x",
          "rotation_angle": 100
        }
      ]
    }
  ]
}
