{
  "scene_name": "processing",
  "frame_start": 0,
  "frame_end": 40,
  "fps": 10,
  "animated_objects": [
    {
      "object_name": "body_x",
      "object_type": "MESH",
      "action_name": "processing",
      "keyframe_data": [
        {
          "frame_number": 0,
          "active_axis": "z",
          "rotation_angle": 90
        },
        {
          "frame_number": 3,
          "active_axis": "z",
          "rotation_angle": 109
        },
        {
          "frame_number": 10,
          "active_axis": "z",
          "rotation_angle": 109
        },
        {
          "frame_number": 14,
          "active_axis": "z",
          "rotation_angle": 96
        },
        {
          "frame_number": 17,
          "active_axis": "z",
          "rotation_angle": 96
        },
        {
          "frame_number": 20,
          "active_axis": "z",
          "rotation_angle": 92
        },
        {
          "frame_number": 26,
          "active_axis": "z",
          "rotation_angle": 92
        },
        {
          "frame_number": 29,
          "active_axis": "z",
          "rotation_angle": 90
        },
        {
          "frame_number": 31,
          "active_axis": "z",
          "rotation_angle": 90
        },
        {
          "frame_number": 34,
          "active_axis": "z",
          "rotation_angle": 70
        },
        {
          "frame_number": 37,
          "active_axis": "z",
          "rotation_angle": 70
        },
        {
          "frame_number": 40,
          "active_axis": "z",
          "rotation_angle": 90
        }
      ]
    },
    {
      "object_name": "head_y",
      "object_type": "EMPTY",
      "action_name": "processing",
      "keyframe_data": [
        {
          "frame_number": 0,
          "active_axis": "x",
          "rotation_angle": 100
        },
        {
          "frame_number": 4,
          "active_axis": "x",
          "rotation_angle": 111
        },
        {
          "frame_number": 10,
          "active_axis": "x",
          "rotation_angle": 111
        },
        {
          "frame_number": 15,
          "active_axis": "x",
          "rotation_angle": 100
        },
        {
          "frame_number": 25,
          "active_axis": "x",
          "rotation_angle": 100
        },
        {
          "frame_number": 28,
          "active_axis": "x",
          "rotation_angle": 120
        },
        {
          "frame_number": 36,
          "active_axis": "x",
          "rotation_angle": 120
        },
        {
          "frame_number": 40,
          "active_axis": "x",
          "rotation_angle": 100
        }
      ]
    }
  ]
}
