{
  "scene_name": "get",
  "frame_start": 0,
  "frame_end": 22,
  "fps": 10,
  "animated_objects": [
    {
      "object_name": "body_x",
      "object_type": "MESH",
      "action_name": "get",
      "keyframe_data": [
        {
          "frame_number": 0,
          "active_axis": "z",
          "rotation_angle": 90
        }
      ]
    },
    {
      "object_name": "head_y",
      "object_type": "EMPTY",
      "action_name": "get",
      "keyframe_data": [
        {
          "frame_number": 0,
          "active_axis": "x",
          "rotation_angle": 100
        },
        {
          "frame_number": 3,
          "active_axis": "x",
          "rotation_angle": 110
        },
        {
          "frame_number": 4,
          "active_axis": "x",
          "rotation_angle": 100
        },
        {
          "frame_number": 7,
          "active_axis": "x",
          "rotation_angle": 100
        },
        {
          "frame_number": 17,
          "active_axis": "x",
          "rotation_angle": 100
        },
        {
          "frame_number": 19,
          "active_axis": "x",
          "rotation_angle": 100
        }
      ]
    }
  ]
}
